{
  "$schema": "https://json-schema.org/draft/2020-12/schema",
  "$id": "https://local.mcpserver/manager/mcpserver.schema.json",
  "title": "MCP Server Manifest",
  "type": "object",
  "additionalProperties": false,
  "required": ["name", "displayName", "version", "transport", "command"],
  "properties": {
    "name": {
      "type": "string",
      "pattern": "^[a-z0-9][a-z0-9-]*[a-z0-9]$"
    },
    "displayName": {
      "type": "string",
      "minLength": 1
    },
    "description": {
      "type": "string"
    },
    "version": {
      "type": "string"
    },
    "transport": {
      "type": "string",
      "enum": ["stdio", "streamable-http", "sse"]
    },
    "host": {
      "type": "string"
    },
    "port": {
      "type": "integer",
      "minimum": 1,
      "maximum": 65535
    },
    "command": {
      "type": "string",
      "minLength": 1
    },
    "args": {
      "type": "array",
      "items": {
        "type": "string"
      }
    },
    "cwd": {
      "type": "string"
    },
    "env": {
      "type": "object",
      "additionalProperties": {
        "type": "string"
      }
    },
    "healthcheck": {
      "type": "object",
      "additionalProperties": false,
      "required": ["type"],
      "properties": {
        "type": {
          "type": "string",
          "enum": ["none", "tcp", "http", "mcp", "command"]
        },
        "url": {
          "type": "string"
        },
        "host": {
          "type": "string"
        },
        "port": {
          "type": "integer",
          "minimum": 1,
          "maximum": 65535
        },
        "command": {
          "type": "string"
        },
        "args": {
          "type": "array",
          "items": {
            "type": "string"
          }
        },
        "intervalSec": {
          "type": "integer",
          "minimum": 1
        },
        "timeoutSec": {
          "type": "integer",
          "minimum": 1
        }
      }
    },
    "autostart": {
      "type": "boolean"
    },
    "restartPolicy": {
      "type": "object",
      "additionalProperties": false,
      "properties": {
        "mode": {
          "type": "string",
          "enum": ["never", "on-failure", "always"]
        },
        "maxRetries": {
          "type": "integer",
          "minimum": 0
        },
        "backoffSec": {
          "type": "integer",
          "minimum": 0
        }
      }
    },
    "logging": {
      "type": "object",
      "additionalProperties": false,
      "properties": {
        "stdout": {
          "type": "string"
        },
        "stderr": {
          "type": "string"
        },
        "rotateMB": {
          "type": "integer",
          "minimum": 1
        }
      }
    },
    "security": {
      "type": "object",
      "additionalProperties": true
    },
    "tags": {
      "type": "array",
      "items": {
        "type": "string"
      }
    }
  }
}
